{
  "run_id": "d06350f2-4cec-476d-b32d-855227a64b20",
  "batch_id": "1aeee72b-7b41-4064-b890-b72c3f42333d",
  "case_id": "suit-01",
  "status": "COMPLETE",
  "validity": "VALID",
  "experiment": {
    "agent_mode": "baseline-tool-calling",
    "context_strategy": null,
    "model": "Qwen/Qwen3.6-35B-A3B",
    "repeat_index": 2
  },
  "sections": {
    "fixed_input": {
      "message": "我的风险承受能力",
      "scene": "portfolio",
      "authenticated": true,
      "history_count": 0,
      "allowed_tools": null
    },
    "context": null,
    "visible_tools": [
      "market.get_financial_statements",
      "market.get_news",
      "market.get_realtime_quote",
      "market.get_valuation",
      "portfolio.get_current_positions",
      "research.web_search",
      "user.get_risk_profile"
    ],
    "model_steps": [
      {
        "seq": 1,
        "decision": "call_tool",
        "latency_ms": 1854
      },
      {
        "seq": 3,
        "decision": "answer",
        "latency_ms": 1847
      }
    ],
    "code_decisions": [],
    "tool_results": [
      {
        "seq": 2,
        "name": "user.get_risk_profile",
        "status": "SUCCESS",
        "summary": {
          "risk_level": "R3",
          "description": "稳健型",
          "risk_tolerance": "moderate"
        },
        "source": "fixture",
        "data_time": null
      }
    ],
    "output_checks": [
      {
        "check": "tool_correct",
        "passed": true
      },
      {
        "check": "number_grounding",
        "passed": true
      },
      {
        "check": "c1_compliance",
        "passed": true
      },
      {
        "check": "c2_compliance",
        "passed": true
      }
    ],
    "final_result": {
      "answer_excerpt": "\n\n根据系统记录，您的风险承受能力画像如下：\n\n*   **风险等级**：R3\n*   **风险偏好**：稳健型\n*   **风险容忍度**：中等\n\n这意味着您在投资时倾向于在控制风险的前提下追求适度收益，通常适合配置平衡型的投资组合。如果您需要针对稳健型投资者的具体投资建议，请随时告诉我。",
      "citations": null,
      "audit_codes": [],
      "judgment": {
        "task_success": true,
        "tool_correct": true,
        "number_grounded": true
      }
    },
    "cost": {
      "duration_ms": 3702,
      "context_ms": 0,
      "llm_ms": 3701,
      "tool_ms": 0,
      "prompt_tokens": 2155,
      "completion_tokens": 193,
      "compression_tokens": 0,
      "tokens_estimated": false
    }
  }
}
