{
  "run_id": "d05d963e-749f-40fe-85d1-1ef859dd460d",
  "batch_id": "1aeee72b-7b41-4064-b890-b72c3f42333d",
  "case_id": "research-01",
  "status": "COMPLETE",
  "validity": "VALID",
  "experiment": {
    "agent_mode": "baseline-tool-calling",
    "context_strategy": null,
    "model": "Qwen/Qwen3.6-35B-A3B",
    "repeat_index": 2
  },
  "sections": {
    "fixed_input": {
      "message": "宁德时代现在什么价",
      "scene": "market",
      "authenticated": false,
      "history_count": 0,
      "allowed_tools": null
    },
    "context": null,
    "visible_tools": [
      "market.get_financial_statements",
      "market.get_news",
      "market.get_realtime_quote",
      "market.get_valuation",
      "portfolio.get_current_positions",
      "research.web_search",
      "user.get_risk_profile"
    ],
    "model_steps": [
      {
        "seq": 1,
        "decision": "call_tool",
        "latency_ms": 899
      },
      {
        "seq": 3,
        "decision": "answer",
        "latency_ms": 546
      }
    ],
    "code_decisions": [],
    "tool_results": [
      {
        "seq": 2,
        "name": "market.get_realtime_quote",
        "status": "SUCCESS",
        "summary": {
          "name": "宁德时代",
          "price": 185.5,
          "change": -2.3,
          "symbol": "300750",
          "volume": 1234567,
          "timestamp": "2026-08-19 14:32:00",
          "pct_change": -1.22
        },
        "source": "fixture",
        "data_time": null
      }
    ],
    "output_checks": [
      {
        "check": "tool_correct",
        "passed": true
      },
      {
        "check": "number_grounding",
        "passed": true
      },
      {
        "check": "c1_compliance",
        "passed": true
      },
      {
        "check": "c2_compliance",
        "passed": true
      }
    ],
    "final_result": {
      "answer_excerpt": "\n\n宁德时代（300750）当前价格为 **185.5 元**，较前一交易日下跌 **2.3 元**，跌幅为 **1.22%**。",
      "citations": null,
      "audit_codes": [],
      "judgment": {
        "task_success": true,
        "tool_correct": true,
        "number_grounded": true
      }
    },
    "cost": {
      "duration_ms": 1446,
      "context_ms": 0,
      "llm_ms": 1445,
      "tool_ms": 0,
      "prompt_tokens": 2234,
      "completion_tokens": 116,
      "compression_tokens": 0,
      "tokens_estimated": false
    }
  }
}
