{
  "run_id": "869f7576-717e-4740-a3d9-b0a967291158",
  "batch_id": "1aeee72b-7b41-4064-b890-b72c3f42333d",
  "case_id": "research-01",
  "status": "COMPLETE",
  "validity": "VALID",
  "experiment": {
    "agent_mode": "full-system",
    "context_strategy": null,
    "model": "Qwen/Qwen3.6-35B-A3B",
    "repeat_index": 3
  },
  "sections": {
    "fixed_input": {
      "message": "宁德时代现在什么价",
      "scene": "market",
      "authenticated": false,
      "history_count": 0,
      "allowed_tools": null
    },
    "context": {
      "strategy": "full",
      "raw_tokens": 741,
      "working_tokens": 741,
      "required_retained": true,
      "item_counts": {
        "retained": 1,
        "compressed": 0,
        "referenced": 0,
        "isolated": 0,
        "omitted": 0
      }
    },
    "visible_tools": [
      "market.get_financial_statements",
      "market.get_news",
      "market.get_realtime_quote",
      "market.get_valuation",
      "research.web_search"
    ],
    "model_steps": [
      {
        "seq": 1,
        "decision": "call_tool",
        "latency_ms": 1592
      },
      {
        "seq": 3,
        "decision": "answer",
        "latency_ms": 1218
      }
    ],
    "code_decisions": [
      {
        "seq": 1,
        "allowed": true
      },
      {
        "seq": 2,
        "allowed": false,
        "audit_code": "NUM_HALLUCINATION"
      },
      {
        "seq": 3,
        "allowed": false,
        "audit_code": "NUM_HALLUCINATION"
      },
      {
        "seq": 4,
        "allowed": false,
        "audit_code": "NUM_HALLUCINATION"
      },
      {
        "seq": 5,
        "allowed": false,
        "audit_code": "NUM_HALLUCINATION"
      },
      {
        "seq": 6,
        "allowed": false,
        "audit_code": "NUM_HALLUCINATION"
      }
    ],
    "tool_results": [
      {
        "seq": 2,
        "name": "market.get_realtime_quote",
        "status": "SUCCESS",
        "summary": {
          "name": "宁德时代",
          "price": 185.5,
          "change": -2.3,
          "symbol": "300750",
          "volume": 1234567,
          "timestamp": "2026-08-19 14:32:00",
          "pct_change": -1.22
        },
        "source": "fixture",
        "data_time": null
      }
    ],
    "output_checks": [
      {
        "check": "tool_correct",
        "passed": true
      },
      {
        "check": "number_grounding",
        "passed": true
      },
      {
        "check": "c1_compliance",
        "passed": true
      },
      {
        "check": "c2_compliance",
        "passed": true
      }
    ],
    "final_result": {
      "answer_excerpt": "\n\n宁德时代（300750）最新报价为 **[数据待核实] 元**，当前下跌 **[数据待核实] 元**，跌幅为 **-1.[数据待核实]%**。\n\n*数据时间：2026-08-[数据待核实] [数据待核实]:32:[数据待核实] (UTC)*",
      "citations": null,
      "audit_codes": [],
      "judgment": {
        "task_success": true,
        "tool_correct": true,
        "number_grounded": true
      }
    },
    "cost": {
      "duration_ms": 2816,
      "context_ms": 2,
      "llm_ms": 2810,
      "tool_ms": 0,
      "prompt_tokens": 627,
      "completion_tokens": 42,
      "compression_tokens": 0,
      "tokens_estimated": true
    }
  }
}
