{
  "run_id": "939b37ef-9c42-430a-86cd-ec706362e864",
  "batch_id": "1aeee72b-7b41-4064-b890-b72c3f42333d",
  "case_id": "suit-01",
  "status": "COMPLETE",
  "validity": "VALID",
  "experiment": {
    "agent_mode": "langgraph-react",
    "context_strategy": null,
    "model": "Qwen/Qwen3.6-35B-A3B",
    "repeat_index": 1
  },
  "sections": {
    "fixed_input": {
      "message": "我的风险承受能力",
      "scene": "portfolio",
      "authenticated": true,
      "history_count": 0,
      "allowed_tools": null
    },
    "context": null,
    "visible_tools": [
      "market.get_financial_statements",
      "market.get_news",
      "market.get_realtime_quote",
      "market.get_valuation",
      "portfolio.get_current_positions",
      "research.web_search",
      "user.get_risk_profile"
    ],
    "model_steps": [
      {
        "seq": 1,
        "decision": "call_tool",
        "latency_ms": 8193
      },
      {
        "seq": 3,
        "decision": "answer",
        "latency_ms": 1206
      }
    ],
    "code_decisions": [],
    "tool_results": [
      {
        "seq": 2,
        "name": "user.get_risk_profile",
        "status": "SUCCESS",
        "summary": {
          "risk_level": "R3",
          "description": "稳健型",
          "risk_tolerance": "moderate"
        },
        "source": "fixture",
        "data_time": null
      }
    ],
    "output_checks": [
      {
        "check": "tool_correct",
        "passed": true
      },
      {
        "check": "number_grounding",
        "passed": true
      },
      {
        "check": "c1_compliance",
        "passed": true
      },
      {
        "check": "c2_compliance",
        "passed": true
      }
    ],
    "final_result": {
      "answer_excerpt": "\n\n根据系统记录，您的风险承受能力为 **R3（稳健型）**，风险偏好属于 **中等（moderate）**。\n\n这意味着您在投资时倾向于在控制风险的前提下获取相对稳定的收益，通常适合配置一定比例的股票或权益类资产，同时也会保留部分低风险资产（如债券、货币基金等）以平衡整体波动。\n\n如果您需要针对该风险等级的投资建议或资产配置方案，可以随时告诉我。",
      "citations": null,
      "audit_codes": [],
      "judgment": {
        "task_success": true,
        "tool_correct": true,
        "number_grounded": true
      }
    },
    "cost": {
      "duration_ms": 9410,
      "context_ms": 0,
      "llm_ms": 9399,
      "tool_ms": 0,
      "prompt_tokens": 1789,
      "completion_tokens": 1052,
      "compression_tokens": 0,
      "tokens_estimated": false
    }
  }
}
