{
  "run_id": "76cda066-a713-434a-a5f9-70af6347fb38",
  "batch_id": "1aeee72b-7b41-4064-b890-b72c3f42333d",
  "case_id": "suit-01",
  "status": "COMPLETE",
  "validity": "VALID",
  "experiment": {
    "agent_mode": "baseline-tool-calling",
    "context_strategy": null,
    "model": "Qwen/Qwen3.6-35B-A3B",
    "repeat_index": 4
  },
  "sections": {
    "fixed_input": {
      "message": "我的风险承受能力",
      "scene": "portfolio",
      "authenticated": true,
      "history_count": 0,
      "allowed_tools": null
    },
    "context": null,
    "visible_tools": [
      "market.get_financial_statements",
      "market.get_news",
      "market.get_realtime_quote",
      "market.get_valuation",
      "portfolio.get_current_positions",
      "research.web_search",
      "user.get_risk_profile"
    ],
    "model_steps": [
      {
        "seq": 1,
        "decision": "call_tool",
        "latency_ms": 1061
      },
      {
        "seq": 3,
        "decision": "answer",
        "latency_ms": 1738
      }
    ],
    "code_decisions": [],
    "tool_results": [
      {
        "seq": 2,
        "name": "user.get_risk_profile",
        "status": "SUCCESS",
        "summary": {
          "risk_level": "R3",
          "description": "稳健型",
          "risk_tolerance": "moderate"
        },
        "source": "fixture",
        "data_time": null
      }
    ],
    "output_checks": [
      {
        "check": "tool_correct",
        "passed": true
      },
      {
        "check": "number_grounding",
        "passed": true
      },
      {
        "check": "c1_compliance",
        "passed": true
      },
      {
        "check": "c2_compliance",
        "passed": false,
        "detail": "含适当性结论：符合您的风险"
      }
    ],
    "final_result": {
      "answer_excerpt": "\n\n根据系统记录，您的风险承受能力画像如下：\n\n*   **风险等级**：R3\n*   **风险类型**：稳健型\n*   **风险偏好**：中等 (Moderate)\n\n这意味着您在投资时倾向于在控制风险的前提下追求适度的收益增长，通常适合配置包含一定比例权益类资产（如股票、偏股型基金）与固定收益类资产（如债券、固收+产品）的平衡型投资组合。\n\n如果您需要针对稳健型投资者的具体配置建议，或者想了解",
      "citations": null,
      "audit_codes": [],
      "judgment": {
        "task_success": false,
        "tool_correct": true,
        "number_grounded": true
      }
    },
    "cost": {
      "duration_ms": 2800,
      "context_ms": 0,
      "llm_ms": 2799,
      "tool_ms": 0,
      "prompt_tokens": 2155,
      "completion_tokens": 268,
      "compression_tokens": 0,
      "tokens_estimated": false
    }
  }
}
